{
  "$schema": "./trade_assist/schemas/backtest.schema.json",
  "data": {
    "tickers": ["NVDA"],
    "index_ticker": "SPY",
    "regime_tickers": ["QQQ", "IWM"],
    "period": "3y",
    "interval": "1d",
    "use_cache": true,
    "cache_dir": ".cache/market_data",
    "cache_ttl_hours": 24,
    "force_refresh": false
  },
  "policy_path": "policies/baseline.json",
  "portfolio": {
    "cash": 10000,
    "positions": {
      "NVDA": 0
    }
  },
  "output": {
    "verbose": false,
    "print_performance_stats": true,
    "save_performance_stats_json": "outputs/backtest_stats.json",
    "print_rebalance_log": false,
    "rebalance_log_tail": 20,
    "save_equity_curve_csv": "outputs/backtest_equity.csv",
    "save_account_history_csv": "outputs/backtest_account_history.csv",
    "save_position_values_csv": "outputs/backtest_position_values.csv",
    "save_full_hold_benchmarks_csv": "outputs/backtest_full_hold_benchmarks.csv",
    "save_rebalance_log_csv": "outputs/backtest_rebalances.csv",
    "plot_equity_curve": true,
    "plot_full_hold_benchmarks": true,
    "full_hold_benchmark_tickers": ["NVDA"],
    "equity_curve_plot_path": "outputs/backtest_equity.png"
  }
}
